{
  "taxonomy_version": "v0_1",
  "reserved_stable_version": "v1_0",
  "function_codes": [
    "A",
    "K",
    "O",
    "F",
    "Y",
    "D",
    "Q",
    "P",
    "R",
    "E",
    "H",
    "G",
    "C",
    "B",
    "X",
    "T",
    "M",
    "L",
    "Z",
    "S",
    "I",
    "U",
    "V",
    "N"
  ],
  "relation_types": [
    "ANS",
    "SUP",
    "EXPL",
    "ELAB",
    "EXMP",
    "ANLG",
    "CONTR",
    "REFUT",
    "RISK",
    "SOLV",
    "SEQ",
    "SUM",
    "CALL",
    "CAUSE",
    "COND"
  ],
  "notes": "Seed taxonomy for scaffold only. Definitions and boundaries are added in later steps."
}
